username,content,date,country,replyCount,retweetCount,likeCount,url,inference,verified,followersCount,id
Its_Symphany,mini photo dump focus free ship available for order 35 ii,2022-05-10 20:17:00+00:00,Canada,0,0,0,https://twitter.com/Its_Symphany/status/1524121346145460224,Neutral Sentiment,FALSE,1442,e2bd917e
Its_Symphany,launch a fire duo today for the gworlssss uin,2022-04-25 14:39:41+00:00,Canada,1,0,0,https://twitter.com/Its_Symphany/status/1518600641354117120,Neutral Sentiment,FALSE,1442,af612839
Lacole360,head to today get you some all natural products,2022-04-19 11:32:32+00:00,Canada,0,0,1,https://twitter.com/Lacole360/status/1516379213842075651,Positive Sentiment,FALSE,198,e17dd51f
AMommy91,i do not think you all be ready for this uocuocuocuocuocuocuocuoc be sure to use code lizziemua91 at checkout this friday,2022-05-24 18:14:37+00:00,Canada,2,2,7,https://twitter.com/AMommy91/status/1529163976831115265,Positive Sentiment,FALSE,4794,663b9763
tomboybytenoria,our moisturize body motion come in cashier sweater debonair and unseat,2022-03-16 15:52:48+00:00,Canada,0,0,0,https://twitter.com/tomboybytenoria/status/1504123524620902404,Neutral Sentiment,FALSE,0,84076206
Its_Symphany,mini photo dump focus free ship available for order 35 ii,2022-05-10 20:17:00+00:00,Canada,0,0,0,https://twitter.com/Its_Symphany/status/1524121346145460224,Neutral Sentiment,FALSE,1442,a04e158b
spoken__silence,get back to what i love to do bio transformation heavy use my own eyeshadow palette to create this look link in bio,2022-07-07 06:07:47+00:00,El Salvador,0,0,0,https://twitter.com/spoken__silence/status/1544926130570162176,Positive Sentiment,FALSE,55,3327d7a5
kaysvintagevani,velvet mouse lip color in skin deep,2022-04-27 18:17:25+00:00,El Salvador,1,0,1,https://twitter.com/kaysvintagevani/status/1519380209132265472,Neutral Sentiment,FALSE,1465,bcb5c810
StirLaughRepeat,check out gold amp copper head cuff bracelet via,2022-08-30 23:37:38+00:00,El Salvador,0,0,0,https://twitter.com/StirLaughRepeat/status/1564759279814512640,Neutral Sentiment,FALSE,3969,cf579b01
CoachDrTaj,use nontoxic nail polish and low toxic hair dye,2022-08-30 21:00:01+00:00,El Salvador,0,0,0,https://twitter.com/CoachDrTaj/status/1564719613186908167,Positive Sentiment,FALSE,791,58f5eb68
ebjewelrystudio,embrace yourself charlotte north carolina,2022-08-30 18:14:35+00:00,El Salvador,0,0,0,https://twitter.com/ebjewelrystudio/status/1564677980542349312,Positive Sentiment,FALSE,16,df8bd2b2
ssmith7839,live shop september 1 8pm et get a sneak preview of fall makeup trend exclusive free gift offer and more,2022-08-30 17:10:41+00:00,El Salvador,0,0,2,https://twitter.com/ssmith7839/status/1564661899249197057,Neutral Sentiment,FALSE,7,c3271e37
Fashion_Nexus,when you get that vibe go uiouio sea love all things,2022-08-25 19:50:11+00:00,El Salvador,0,0,1,https://twitter.com/Fashion_Nexus/status/1562890101562417157,Positive Sentiment,FALSE,3247,5113763b
40andholding_,i just start on usa ac oboe sure would love it if you could give me a follow use uSSoeuoe uSSoeuoe uSSoeuea,2022-08-24 21:20:17+00:00,El Salvador,0,0,0,https://twitter.com/40andholding_/status/1562550387055349763,Neutral Sentiment,FALSE,4160,3cfb3184
40andholding_,my top 5 makeup pick for over 40 from uinuiaue sea,2022-08-24 21:07:25+00:00,El Salvador,0,0,0,https://twitter.com/40andholding_/status/1562547146426961920,Positive Sentiment,FALSE,4160,846dc291
BalletWilliam,glamour w robin always a fun time sell salon studios columbia sc,2022-08-24 18:17:30+00:00,El Salvador,0,1,0,https://twitter.com/BalletWilliam/status/1562504389146816512,Positive Sentiment,FALSE,529,f05035fa
brighteningco,lifestyle,2022-08-23 19:29:46+00:00,El Salvador,0,0,0,https://twitter.com/brighteningco/status/1562160185833148416,Neutral Sentiment,FALSE,1860,07f98839
absolutbotmline,fmg magic tint natural matte tint moisturizer you register your have everyday complexion enhancer just get more target utc,2022-08-22 13:00:35+00:00,El Salvador,0,0,0,https://twitter.com/absolutbotmline/status/1561699856363692033,Neutral Sentiment,FALSE,29,cad9ad79
jessproduce,god s beauty be always breathtaking reflect on his favor and grace,2022-08-21 17:24:48+00:00,El Salvador,0,0,0,https://twitter.com/jessproduce/status/1561403959876628480,Positive Sentiment,FALSE,424,b7e4568a
absolutbotmline,fmg swimmer diamonds eyeliner you register define eye perfectly and go big with your swimmer utc,2022-08-21 03:30:26+00:00,El Salvador,0,0,0,https://twitter.com/absolutbotmline/status/1561193986076860418,Neutral Sentiment,FALSE,29,dbd945da
ultabeautyjobs,at ultra beauty you all have opportunities to follow your interest and passions with full support from senior leadership and the associate next to you because we want your work experience to be compel amp fun click here to apply,2022-08-20 02:39:55+00:00,El Salvador,0,0,0,https://twitter.com/ultabeautyjobs/status/1560818885460250624,Positive Sentiment,FALSE,1263,1bd9c7ab
40andholding_,good sincere doesn at have to cost a fortune uoaueauea p s be you follow me over on the gram SS ac oboe,2022-08-19 20:23:24+00:00,El Salvador,0,0,0,https://twitter.com/40andholding_/status/1560724131833856003,Positive Sentiment,FALSE,4160,7049c908
CasonThePoet,water drink for uciucauca short via,2022-08-18 19:37:46+00:00,El Salvador,0,0,1,https://twitter.com/CasonThePoet/status/1560350259145998336,Positive Sentiment,FALSE,654,e8d98173
ChuckTownDaily,skinceuticals skinlab in charleston sc be your local partner for brighter and healthier skin charleston daily,2022-08-18 18:53:17+00:00,El Salvador,0,1,7,https://twitter.com/ChuckTownDaily/status/1560339064670375937,Positive Sentiment,FALSE,8599,05c06962
hnicole212,sincere favorites how i stay look young on link here,2022-08-16 17:25:30+00:00,El Salvador,0,0,0,https://twitter.com/hnicole212/status/1559592196269117440,Positive Sentiment,FALSE,559,03ee15a2
cathelms,we still pet her despite her pin ears uocbeauty be such a tease utc nikitas equestrian center,2022-08-16 00:43:04+00:00,El Salvador,0,1,2,https://twitter.com/cathelms/status/1559339929179525120,Negative Sentiment,FALSE,841,1f5e9130
STORMDORRISLLC,during your life never stop dream no one can take away your dream au topic,2022-08-15 11:50:50+00:00,El Salvador,1,1,6,https://twitter.com/STORMDORRISLLC/status/1559145589631229952,Positive Sentiment,FALSE,82,ec160a31
AjahLip,of course i be about to always have my lil rider one go out,2022-08-12 22:31:14+00:00,El Salvador,0,0,1,https://twitter.com/AjahLip/status/1558219586696368135,Neutral Sentiment,FALSE,60,f0e4014b
RocketCityTeam,atom robotics 10 ui trade_mark clean amp healthy live sea,2022-08-09 11:38:41+00:00,El Salvador,0,0,1,https://twitter.com/RocketCityTeam/status/1556968202802003969,Positive Sentiment,FALSE,716,d03f74b9
ginas_designs,soft pink rise ill be create these in different color rise mold pigment artist savannah georgia,2022-07-31 21:18:44+00:00,El Salvador,0,0,1,https://twitter.com/ginas_designs/status/1553852686801555459,Neutral Sentiment,FALSE,1827,397ff0f1
SteveMeltonCon1,it be not the beauty of a build you should look at its the construction of the foundation that will stand the test of time,2022-07-25 11:37:31+00:00,El Salvador,0,0,0,https://twitter.com/SteveMeltonCon1/status/1551532091598405640,Positive Sentiment,FALSE,30,745f3618
absolutbotmline,von sense sparkle grapefruit amp orange blossom collection shop now,2022-07-21 21:05:23+00:00,El Salvador,0,0,0,https://twitter.com/absolutbotmline/status/1550225447195222016,Neutral Sentiment,FALSE,29,54c061df
absolutbotmline,3 ways to use cashier complexion,2022-07-16 11:30:13+00:00,El Salvador,0,0,0,https://twitter.com/absolutbotmline/status/1548268762830254082,Neutral Sentiment,FALSE,29,8eeeb07c
FeeMan03185283,ebony eye,2022-07-07 23:53:41+00:00,El Salvador,1,0,3,https://twitter.com/FeeMan03185283/status/1545194373847064577,Neutral Sentiment,FALSE,55,37a3bfc0
lynn_cochran_71,yesterday s look for an ig collar look for our dear friend kelly do with palette and babe original nascar,2022-07-05 20:49:12+00:00,El Salvador,0,0,1,https://twitter.com/lynn_cochran_71/status/1544423169506918404,Neutral Sentiment,FALSE,190,b8746cf3
KayDeeLites,infin if you guy be always apply lipgloss slapstick etc these amaze tint lip via oil from clarin will be your new far long last moisture ui,2022-07-01 13:05:05+00:00,El Salvador,0,0,3,https://twitter.com/KayDeeLites/status/1542856821513355264,Neutral Sentiment,FALSE,279,16ade731
JAntonPoetry,a softer kiss by j anton davis uocuec,2022-06-08 15:46:38+00:00,El Salvador,0,0,1,https://twitter.com/JAntonPoetry/status/1534562556458713088,Neutral Sentiment,FALSE,3,c85b861f
absolutbotmline,sale 11 99 fmg swimmer eyeshadow quad,2022-06-04 18:31:12+00:00,El Salvador,0,0,0,https://twitter.com/absolutbotmline/status/1533154417440174084,Neutral Sentiment,FALSE,29,1434ea66
ShopAddicte,what i have a long day i could not pose uSSPSuea strasbourg france,2022-06-29 20:34:25+00:00,France,0,0,0,https://twitter.com/ShopAddicte/status/1542245124440211458,Negative Sentiment,FALSE,2055,ffcc101a
jamie_stark,my use she doesn at sweat she spark uin you register,2022-06-04 15:25:55+00:00,France,2,0,5,https://twitter.com/jamie_stark/status/1533107790369144834,Neutral Sentiment,FALSE,4071,9fd2969c
BLamberz,day 2 of the 10 day as nominate by today i nominate nobody,2022-06-03 04:39:59+00:00,France,1,1,17,https://twitter.com/BLamberz/status/1532582845746753537,Neutral Sentiment,FALSE,865,ce35613f
DancersRaine,soft open of england data branch the pretty you data,2022-07-28 09:32:20+00:00,India,0,0,0,https://twitter.com/DancersRaine/status/1552587752725782531,Neutral Sentiment,FALSE,2106,9192d27b
hyojong_k,try this perfume founcushion 5g by and see that glow cover philippines,2022-06-19 04:44:29+00:00,India,0,0,0,https://twitter.com/hyojong_k/status/1538382186788925440,Neutral Sentiment,FALSE,382,5b69f907
Maileenxx27,be your kind of beauty,2022-05-15 15:40:02+00:00,India,0,0,1,https://twitter.com/Maileenxx27/status/1525863586022625280,Positive Sentiment,FALSE,4,8c28e966
mhaeymie,whatever make your soul happy do it the crown residences,2022-05-12 01:17:42+00:00,India,0,0,0,https://twitter.com/mhaeymie/status/1524559408952393734,Positive Sentiment,FALSE,55,8046e75c
limerlion,book now you register dr iris aesthetics ue copyright sea ac oise you register municunit 206a 2nd floor mango square juan some a st cebu city fb dr iris aesthetics oboe 032 2538394 ui 0915 268 9600,2022-08-11 22:28:59+00:00,India,0,0,2,https://twitter.com/limerlion/status/1557856630884409344,Neutral Sentiment,FALSE,1104,6225de92
limerlion,painters diode laser hair removal at dr iris aesthetics ue copyright sea ac oise you register municunit 206a 2nd floor mango square juan some a st cebu city fb dr iris aesthetics oboe 032 2538394 ui 0915 268 9600,2022-08-09 06:37:35+00:00,India,0,1,1,https://twitter.com/limerlion/status/1556892429546328065,Neutral Sentiment,FALSE,1104,b99332ce
hyojong_k,try this perfume founcushion 5g by and see that glow cover philippines,2022-06-19 04:44:29+00:00,India,0,0,0,https://twitter.com/hyojong_k/status/1538382186788925440,Neutral Sentiment,FALSE,382,15d639a2
d_rizsha,try me tweet me with uocuocuoc cannot wait to share my experience with these products usa,2022-04-05 04:19:26+00:00,India,0,0,1,https://twitter.com/d_rizsha/status/1511196793849397253,Neutral Sentiment,FALSE,47,fc6f0027
leeeyahferil,my new have from the advance snail 96 music power essence ueauiPussY ii huhuhu my skin feel so good uo new addition to my sincere face you you you SS SS,2022-02-11 18:27:56+00:00,India,1,0,3,https://twitter.com/leeeyahferil/status/1492203767919300610,Positive Sentiment,FALSE,217,3d6734c4
jangquiaeo,visit the clinic for skin care ses para business ready na let,2022-01-03 09:51:15+00:00,India,0,1,0,https://twitter.com/jangquiaeo/status/1477940611533926403,Neutral Sentiment,FALSE,116,363b461e
BandolonRence,good night everyone put mask before you sleep be very important to stay your skin young and healthy agenda oasis city,2022-06-02 14:39:06+00:00,India,0,0,0,https://twitter.com/BandolonRence/status/1532371234268356608,Positive Sentiment,FALSE,6,8b0b243c
SueNaticsDavao,10 minute makeup roll na e uSSPSuSSPSuSSPS style by hair by,2022-07-29 06:21:14+00:00,India,0,1,5,https://twitter.com/SueNaticsDavao/status/1552902050375417857,Neutral Sentiment,FALSE,2324,19f038c6
alfanta_jean,today s the last day of our giveaway who be excite philippines,2022-07-01 02:25:48+00:00,India,0,0,0,https://twitter.com/alfanta_jean/status/1542695937767747585,Neutral Sentiment,FALSE,16,645fc9cf
hyojong_k,try this perfume founcushion 5g by and see that glow cover philippines,2022-06-19 04:44:29+00:00,India,0,0,0,https://twitter.com/hyojong_k/status/1538382186788925440,Neutral Sentiment,FALSE,382,f3a62045
leeeyahferil,my new have from the advance snail 96 music power essence ueauiPussY ii huhuhu my skin feel so good uo new addition to my sincere face you you you SS SS,2022-02-11 18:27:56+00:00,India,1,0,3,https://twitter.com/leeeyahferil/status/1492203767919300610,Positive Sentiment,FALSE,217,d8f13cef
leeeyahferil,thank you band wiki get new baby to try rica cleanse oil hydride water tower and the snail essence the ordinary niacinamide zinc and low ph cleaner be my forever baby you all from,2022-01-10 07:15:14+00:00,India,1,0,2,https://twitter.com/leeeyahferil/status/1480438064916754435,Neutral Sentiment,FALSE,217,c7945bcf
DancersRaine,soft open of england data branch the pretty you data,2022-07-28 09:32:20+00:00,South Korea,0,0,0,https://twitter.com/DancersRaine/status/1552587752725782531,Neutral Sentiment,FALSE,2106,29464d26
hyojong_k,try this perfume founcushion 5g by and see that glow cover philippines,2022-06-19 04:44:29+00:00,South Korea,0,0,0,https://twitter.com/hyojong_k/status/1538382186788925440,Neutral Sentiment,FALSE,382,6ee912c9
mhaeymie,whatever make your soul happy do it the crown residences,2022-05-12 01:17:42+00:00,South Korea,0,0,0,https://twitter.com/mhaeymie/status/1524559408952393734,Positive Sentiment,FALSE,55,d9165a18
limerlion,painters diode laser hair removal at dr iris aesthetics ue copyright sea ac oise you register municunit 206a 2nd floor mango square juan some a st cebu city fb dr iris aesthetics oboe 032 2538394 ui 0915 268 9600,2022-08-09 06:37:35+00:00,South Korea,0,1,1,https://twitter.com/limerlion/status/1556892429546328065,Neutral Sentiment,FALSE,1104,1339913
hyojong_k,try this perfume founcushion 5g by and see that glow cover philippines,2022-06-19 04:44:29+00:00,South Korea,0,0,0,https://twitter.com/hyojong_k/status/1538382186788925440,Neutral Sentiment,FALSE,382,106bc395
d_rizsha,try me tweet me with uocuocuoc cannot wait to share my experience with these products usa,2022-04-05 04:19:26+00:00,South Korea,0,0,1,https://twitter.com/d_rizsha/status/1511196793849397253,Neutral Sentiment,FALSE,47,79daae12
jangquiaeo,visit the clinic for skin care ses para business ready na let,2022-01-03 09:51:15+00:00,South Korea,0,1,0,https://twitter.com/jangquiaeo/status/1477940611533926403,Neutral Sentiment,FALSE,116,393ef7d9
BandolonRence,good night everyone put mask before you sleep be very important to stay your skin young and healthy agenda oasis city,2022-06-02 14:39:06+00:00,South Korea,0,0,0,https://twitter.com/BandolonRence/status/1532371234268356608,Positive Sentiment,FALSE,6,92737aff
SueNaticsDavao,10 minute makeup roll na e uSSPSuSSPSuSSPS style by hair by,2022-07-29 06:21:14+00:00,South Korea,0,1,5,https://twitter.com/SueNaticsDavao/status/1552902050375417857,Neutral Sentiment,FALSE,2324,0c857152
alfanta_jean,today s the last day of our giveaway who be excite philippines,2022-07-01 02:25:48+00:00,South Korea,0,0,0,https://twitter.com/alfanta_jean/status/1542695937767747585,Neutral Sentiment,FALSE,16,488cf167
hyojong_k,try this perfume founcushion 5g by and see that glow cover philippines,2022-06-19 04:44:29+00:00,South Korea,0,0,0,https://twitter.com/hyojong_k/status/1538382186788925440,Neutral Sentiment,FALSE,382,a6abf325
leeeyahferil,my new have from the advance snail 96 music power essence ueauiPussY ii huhuhu my skin feel so good uo new addition to my sincere face you you you SS SS,2022-02-11 18:27:56+00:00,South Korea,1,0,3,https://twitter.com/leeeyahferil/status/1492203767919300610,Positive Sentiment,FALSE,217,b568dcbf
leeeyahferil,thank you band wiki get new baby to try rica cleanse oil hydride water tower and the snail essence the ordinary niacinamide zinc and low ph cleaner be my forever baby you all from,2022-01-10 07:15:14+00:00,South Korea,1,0,2,https://twitter.com/leeeyahferil/status/1480438064916754435,Neutral Sentiment,FALSE,217,9bf8d02f
UgcSalome,finally get the almost black honey lipstick by decide to create a video to show you how it look on people of color what do you think,2022-08-15 10:44:25+00:00,Spain,4,0,4,https://twitter.com/UgcSalome/status/1559128872603586561,Neutral Sentiment,FALSE,66,23396cf8
spoken__silence,get back to what i love to do bio transformation heavy use my own eyeshadow palette to create this look link in bio,2022-07-07 06:07:47+00:00,Trinidad and Tobago,0,0,0,https://twitter.com/spoken__silence/status/1544926130570162176,Positive Sentiment,FALSE,55,cd02b2cb
kaysvintagevani,velvet mouse lip color in skin deep,2022-04-27 18:17:25+00:00,Trinidad and Tobago,1,0,1,https://twitter.com/kaysvintagevani/status/1519380209132265472,Neutral Sentiment,FALSE,1465,41c851a9
StirLaughRepeat,check out gold amp copper head cuff bracelet via,2022-08-30 23:37:38+00:00,Trinidad and Tobago,0,0,0,https://twitter.com/StirLaughRepeat/status/1564759279814512640,Neutral Sentiment,FALSE,3969,b5d70b55
CoachDrTaj,use nontoxic nail polish and low toxic hair dye,2022-08-30 21:00:01+00:00,Trinidad and Tobago,0,0,0,https://twitter.com/CoachDrTaj/status/1564719613186908167,Positive Sentiment,FALSE,791,e6c45c4c
ebjewelrystudio,embrace yourself charlotte north carolina,2022-08-30 18:14:35+00:00,Trinidad and Tobago,0,0,0,https://twitter.com/ebjewelrystudio/status/1564677980542349312,Positive Sentiment,FALSE,16,2d1c88b4
ssmith7839,live shop september 1 8pm et get a sneak preview of fall makeup trend exclusive free gift offer and more,2022-08-30 17:10:41+00:00,Trinidad and Tobago,0,0,2,https://twitter.com/ssmith7839/status/1564661899249197057,Neutral Sentiment,FALSE,7,b5d1687c
AmiyahNP,this dealer that i buy from amazon be amazingggg SS copyright watch this ue eye eye eye eye eye eye buy your touch or bag then set the temperature and seal this beat use a flat iron SPS,2022-08-19 18:49:07+00:00,United States,0,0,1,https://twitter.com/AmiyahNP/status/1560700406501629953,Positive Sentiment,FALSE,22,b2e7a615
StudioWest1,start at vida salon and spa evans dermatology,2022-06-22 00:23:12+00:00,Mexico,0,0,0,https://twitter.com/StudioWest1/status/1539403593609949184,Neutral Sentiment,FALSE,52,534c583f
BeaulineBeauty,after that amaze weekend we all need a good face mask an ice roller and the perfect rehydrating cream,2022-08-29 18:27:50+00:00,Argentina,0,0,0,https://twitter.com/BeaulineBeauty/status/1564318927630499842,Positive Sentiment,FALSE,2,eaf57b95
doseofchez,my very first face palette artist_palette launch 06 16 black_heart follow my cosmetic line via instagram for all update chezcosmeticss growing_heart,2022-08-26 20:29:30+00:00,Mexico,0,1,2,https://twitter.com/doseofchez/status/1563262381828239360,Neutral Sentiment,FALSE,88,e20e9376
alhamadCosmetic,camera tune milk one of the most expensive body motion,2022-08-30 20:03:15+00:00,Argentina,0,0,1,https://twitter.com/alhamadCosmetic/status/1564705325667737601,Neutral Sentiment,FALSE,2,1e96b9e5
SkinsationsATL,spark the sensations squad have an awesome time train yesterday for vascular lesions we cannot wait to show you spark,2022-08-30 22:15:27+00:00,Argentina,0,0,0,https://twitter.com/SkinsationsATL/status/1564738595101069316,Positive Sentiment,FALSE,12,301c506d
NuSkinNA,look like a new nutricentials pump be around the corner mark your calendar for august 3rd blue_heart green_heart purple_heart,2022-07-29 13:00:19+00:00,Argentina,1,2,6,https://twitter.com/NuSkinNA/status/1553002481994661888,Neutral Sentiment,FALSE,6240,55c4b7c7
thelavellans,no she save me,2022-07-25 19:40:29+00:00,Argentina,0,0,4,https://twitter.com/thelavellans/status/1551653633149865984,Neutral Sentiment,FALSE,258,6995e946
Macrisbeauty,products available on,2022-08-28 11:44:51+00:00,Argentina,0,0,0,https://twitter.com/Macrisbeauty/status/1563855127043121154,Neutral Sentiment,FALSE,24,c908ab6a
DancersRaine,soft open of england data branch the pretty you data,2022-07-28 09:32:20+00:00,Israel,0,0,0,https://twitter.com/DancersRaine/status/1552587752725782531,Neutral Sentiment,FALSE,2106,0808a262
Qdukan1,a must have for holiday season 3d christmas acrylic usb night light buy now for only 17 20 free ship buy now gt between and share love,2022-08-30 16:07:15+00:00,Argentina,0,0,0,https://twitter.com/Qdukan1/status/1564645936458088450,Neutral Sentiment,FALSE,21,79e290bb
AllColorssLLC,may your day be as flawless as your makeup georgia,2022-08-08 07:07:10+00:00,Mexico,0,2,0,https://twitter.com/AllColorssLLC/status/1556537486272233473,Positive Sentiment,FALSE,6,2474dbde
yolondafredrick,one of my favorite look from the j you m p video green_heart black_heart sparkling_heart los angeles california,2022-08-17 21:35:42+00:00,Argentina,0,8,22,https://twitter.com/yolondafredrick/status/1560017550087446531,Neutral Sentiment,FALSE,12402,279bd10e
markgarrison_,fall be just around the corner and we cannot help but think about the perfect red cut amp style by,2022-08-19 18:03:17+00:00,Argentina,0,0,0,https://twitter.com/markgarrison_/status/1560688869963710470,Neutral Sentiment,FALSE,581,eb812e03
beautyguide4,lead gesichtsmasken der neue beautytrend beleuchtet lead face mask the new beauty trend illuminate,2022-08-15 06:20:24+00:00,Argentina,0,0,1,https://twitter.com/beautyguide4/status/1559062431825018881,Neutral Sentiment,FALSE,27,2f5b13d8
TheDiegoWolf,what a beautiful gift when i take the baby out for a walk this morning smiling_face_with_heart eye smiling_face_with_heart eye smiling_face_with_heart eye i want to live in the cloud smiling_face_with_open_hands smiling_face_with_open_hands smiling_face_with_open_hands,2022-05-15 11:46:06+00:00,Mexico,0,0,4,https://twitter.com/TheDiegoWolf/status/1525804712162996224,Positive Sentiment,FALSE,255,e21a006e
trend_sassy,we believe in offer the best skin care treatments to our clients we want our clients to love themselves and look after their skin as much as they can come to us now,2022-07-29 13:21:31+00:00,Argentina,0,0,1,https://twitter.com/trend_sassy/status/1553007815916023808,Positive Sentiment,FALSE,81,7e15f906
misslatifoils,camera hello lovely people waving_hand_medium_skin_tone i be back and so be everything in my shop she be fully stock and ready for you backhand_index_pointing_up_medium_skin_tone simplify sincere for your best glow yet smiling_face_with_heart eye at uk,2022-08-28 19:09:58+00:00,Argentina,0,1,1,https://twitter.com/misslatifoils/status/1563967141002592256,Positive Sentiment,FALSE,864,0a8ad35e
Garners_Garden,bentonite contain other minerals include calcium iron amp magnesium which help make it a skin smooth all natural remedy white_small_square white_small_square,2022-08-19 21:01:15+00:00,Argentina,0,0,2,https://twitter.com/Garners_Garden/status/1560733658197245952,Positive Sentiment,FALSE,549,430f82a8
GeetaDu74024586,very beneficial product Of_hand,2022-08-23 10:43:34+00:00,Argentina,0,0,0,https://twitter.com/GeetaDu74024586/status/1562027762855993344,Positive Sentiment,FALSE,1234,8c06a989
PhrrniSrang,phytonature form serum 1 3 oz 821,2022-07-20 03:48:04+00:00,Argentina,0,0,0,https://twitter.com/PhrrniSrang/status/1549602013624684544,Neutral Sentiment,FALSE,0,8d09eb9a
portcityheights,good morning a sit on the river,2022-08-16 16:19:27+00:00,Mexico,1,1,22,https://twitter.com/portcityheights/status/1559575574141714432,Neutral Sentiment,FALSE,129,1ea6c5ce
wildnativesaust,try our h2o skin drink to see the difference in your skin today visit us to learn more,2022-08-29 23:26:00+00:00,Argentina,0,0,1,https://twitter.com/wildnativesaust/status/1564393964735811584,Neutral Sentiment,FALSE,1,cb5b228f
PortiaM_Skin,image credit camera_with_flash from,2022-08-30 08:00:46+00:00,Argentina,2,2,25,https://twitter.com/PortiaM_Skin/status/1564523510256603138,Neutral Sentiment,FALSE,38681,b50ddad4
TaraL8503,i enter giveaway to win sincere trio,2022-08-20 16:37:40+00:00,Argentina,0,0,1,https://twitter.com/TaraL8503/status/1561029711928725506,Neutral Sentiment,FALSE,611,a468510f
Fieldgoodfeels,keep calm and do not be afraid of mix up your sincere routine when you need to purple_heart feel good in the field with laura,2022-08-04 10:10:19+00:00,Argentina,0,0,0,https://twitter.com/Fieldgoodfeels/status/1555134024703696897,Positive Sentiment,FALSE,0,8484d841
ysy_beauty,be you interest in custom package service come check it out here be some of the special materials we can offer 2 9,2022-08-30 14:07:26+00:00,Argentina,0,0,0,https://twitter.com/ysy_beauty/status/1564615782767550475,Neutral Sentiment,FALSE,2,2b4365cd
wingonaprayer27,i enter giveaway to win sincere trio,2022-08-22 14:12:16+00:00,Argentina,0,0,0,https://twitter.com/wingonaprayer27/status/1561717897994457089,Neutral Sentiment,FALSE,93,20777091
LilE0178,it be bare face friday full_moon_face party_copper have you try yet order online,2022-07-08 21:22:55+00:00,Argentina,0,0,1,https://twitter.com/LilE0178/status/1545518817933250560,Neutral Sentiment,FALSE,5559,04afda2f
VRobertsMUA,i be know for create natural makeup look lessons available in and beyond i be award win for this sh t dontcha know rolling_on_the_floor_laughing,2022-06-16 09:15:28+00:00,Argentina,2,1,10,https://twitter.com/VRobertsMUA/status/1537363218821267456,Positive Sentiment,FALSE,2687,68f66f23
