username,content,date,country,replyCount,retweetCount,likeCount,url,inference,verified,followersCount,id
ZoriaSkinCare,be drug store nascar cause your eye to be irritate ria sincere offer two different mascaras develop by ophthalmologists for sensitive eye,2021-12-22 18:30:00+00:00,Argentina,0,3,1,https://twitter.com/ZoriaSkinCare/status/1473722507471556619,Positive Sentiment,FALSE,195,3d9b1435
thehealingmine,grab your note bag and head off on a much need self care road trip do not forget to take heal mine s face tea mist,2021-12-23 08:20:36+00:00,Argentina,0,0,1,https://twitter.com/thehealingmine/status/1473931533027266560,Neutral Sentiment,FALSE,3,4d6bb3a6
EvilAndy_Warhol,i find these while out i be really go to have to do this more often,2021-10-25 15:58:52+00:00,Mexico,0,0,1,https://twitter.com/EvilAndy_Warhol/status/1452665975535546373,Neutral Sentiment,FALSE,131,52850b7a
kiratoniqua,check out the dose of color stay glossy,2021-12-24 13:28:06+00:00,Mexico,0,0,0,https://twitter.com/kiratoniqua/status/1474371306204315678,Positive Sentiment,FALSE,1295,a8b7ada3
NutmegDiaries,aff need a little spa night do not forget your lip mask,2021-12-24 13:00:32+00:00,Argentina,0,2,2,https://twitter.com/NutmegDiaries/status/1474364368087404545,Neutral Sentiment,FALSE,553,011c60e6
janeeceent,when it come to daily struggle of life amp your tire of run around relax amp let take care of your need,2021-12-27 23:51:16+00:00,Argentina,0,0,0,https://twitter.com/janeeceent/status/1475615295452635137,Negative Sentiment,FALSE,13205,a959be04
pahanyalife,we be collaborate with our sister company for this pop up sale come meet us at the bayleaf restaurant this sunday 5th december for some new cool items and discount,2021-12-03 00:30:39+00:00,Argentina,0,0,0,https://twitter.com/pahanyalife/status/1466565510703853572,Neutral Sentiment,FALSE,4,2556c342
cwoolsey321,yes yes i be sorry we be still work on the whole elicit of youth thing face_with_tears_of_joy but until that day why not do the next best thing and improve your sincere routine person_tipping_hand,2021-12-27 19:20:23+00:00,Argentina,0,0,0,https://twitter.com/cwoolsey321/status/1475547123475226628,Negative Sentiment,FALSE,14,b55a62d5
naturals700,festive makeup look smiling_face_with_heart eye yellow_heart,2021-12-27 11:55:49+00:00,Argentina,0,0,0,https://twitter.com/naturals700/status/1475435245881094144,Positive Sentiment,FALSE,22,1634a9e0
Pandora16270480,with even approach i be so grateful and thankful for this beautiful day with wish for a lovely even for you me and the whole universe,2021-12-27 21:07:33+00:00,Argentina,0,16,25,https://twitter.com/Pandora16270480/status/1475574095463030793,Positive Sentiment,FALSE,12545,840e45fa
jeritwist,time for my skin care face_blowing_a_kiss skinthrex aesthetic clinic by skin aesthetic center,2021-11-17 00:23:37+00:00,Israel,0,0,0,https://twitter.com/jeritwist/status/1460765535172321284,Positive Sentiment,FALSE,289,6beb1851
SkinAndVeinCntr,become a skin fitness member today amp have great skin for life our skin fitness membership be design to help you achieve amp maintain beautiful skin for life glowing_star,2021-12-23 14:30:00+00:00,Argentina,0,0,1,https://twitter.com/SkinAndVeinCntr/status/1474024495866277891,Positive Sentiment,FALSE,12,252c09bf
hogaryejercici1,United_States how skin care in winter eye backhand_index_pointing_right check_mark_button red_heart,2021-12-01 14:49:07+00:00,Argentina,0,0,0,https://twitter.com/hogaryejercici1/status/1466056773568282625,Negative Sentiment,FALSE,1660,b6fde7ee
Skynn101,your skin be 90 of your self be you take care of your skin share your best sincere tip below right_arrow_curving_down calgary alberta,2021-10-16 17:49:28+00:00,Argentina,0,0,0,https://twitter.com/Skynn101/status/1449432318049882113,Neutral Sentiment,FALSE,11,1c89ec5a
Eden_Shopping,switch up your sincere with the premium beauty range from smiling_face_with_heart eye from clays to jelly cleaners treat your skin to what it deserve the very best check out the range in store,2021-10-07 15:04:02+00:00,Argentina,0,0,0,https://twitter.com/Eden_Shopping/status/1446129196581851139,Positive Sentiment,FALSE,3621,d7a3dcb8
herbalskyn,your health be an investment not an expense although it will become an expense if you do not take time to invest in it,2021-10-20 11:37:50+00:00,Mexico,0,1,1,https://twitter.com/herbalskyn/status/1450788344242311171,Negative Sentiment,FALSE,50,45348551
AAFPRS,get ahead of the trend take advantage of the many benefit of to feel refresh and ready to take on 2022,2021-12-23 20:02:05+00:00,Argentina,0,0,0,https://twitter.com/AAFPRS/status/1474108065351749632,Positive Sentiment,FALSE,8773,437f629b
UsagiThePrince,just do some everyday makeup uw sparkling_heart pleading_face,2021-12-08 02:02:28+00:00,Argentina,0,0,4,https://twitter.com/UsagiThePrince/status/1468400553495392257,Positive Sentiment,FALSE,172,f8607fe9
Matt_Bandowski,there be beauty about a woman who believe in herself who know she be of anything that she put her to there be a in the and of a who follow her own who be not off by along the,2021-12-27 20:19:10+00:00,Argentina,1,0,0,https://twitter.com/Matt_Bandowski/status/1475561916210851841,Positive Sentiment,FALSE,173,bf8b540e
Naturaldivinit1,introduce watermelon hydration collection watermelon spark my gift to you this season be receive a free peppermint shine hair grease with any purchase december 2021 month only natural divinity products spark,2021-12-06 01:14:39+00:00,Argentina,1,1,4,https://twitter.com/Naturaldivinit1/status/1467663745404915712,Positive Sentiment,FALSE,79,0d52f24c
katlaue,look after your skin specially your face be so important so what be your favorite do you want a foam wash or a cream cleaner thinking_face green_heart,2021-11-15 23:00:13+00:00,Argentina,0,0,0,https://twitter.com/katlaue/status/1460382157944373249,Positive Sentiment,FALSE,166,74ad1897
MonroeAriLC,wear our 18 brazilian deep wave wig amp 25 mm july mink lash smiling_face_with_heart eye smiling_face_with_heart eye smiling_face_with_heart eye columbia south carolina,2021-11-19 17:38:17+00:00,Mexico,0,0,0,https://twitter.com/MonroeAriLC/status/1461750690506854404,Neutral Sentiment,FALSE,64,7446a14c
Dermaka,dermal cream register contain anica montana which can have an anti inflammatory effect and help to decrease cruise learn more about our natural ingredients here,2021-12-27 16:24:59+00:00,Argentina,0,0,0,https://twitter.com/Dermaka/status/1475502981936300033,Positive Sentiment,FALSE,371,49d19bb1
denisevasi,this new 3 step microcurrent routine leave my skin tone lift and colour and it only take me a few minutes each day,2021-10-22 22:48:27+00:00,Argentina,0,1,2,https://twitter.com/denisevasi/status/1451681887605428231,Positive Sentiment,TRUE,38217,07310f2c
tatagaltier,tape bill para be honey_pot throughout the day tu mm less oily manga and my skin become more plum every time kill gun urls look at how happy she be amp how many bottle she be already use we want to cry loudly_crying_face,2021-11-15 02:21:56+00:00,Argentina,1,9,6,https://twitter.com/tatagaltier/status/1460070534356484101,Positive Sentiment,FALSE,1207,b8e8f45d
ShilohBeauty,todays look be inspire by a beautiful young artist who be 19 years younger than me red_heart,2021-10-13 15:06:27+00:00,Argentina,1,1,3,https://twitter.com/ShilohBeauty/status/1448304129185562629,Positive Sentiment,FALSE,1,9be2b23f
jesawalker,enter to win a makeup prize pack new book from,2021-12-27 12:01:59+00:00,Argentina,0,0,0,https://twitter.com/jesawalker/status/1475436798495105034,Neutral Sentiment,FALSE,950,1a3fb5c7
dwaynekmatthews,get outside in nature if you can take some picture that focus on beauty to balance your twitter news intake,2021-12-27 22:37:53+00:00,Argentina,1,0,2,https://twitter.com/dwaynekmatthews/status/1475596826225090563,Positive Sentiment,FALSE,758,6761ac56
kellydobos,the eye still have it new york fashion week spring 2022 the biggest hair and makeup look,2021-10-08 13:10:02+00:00,Argentina,0,0,1,https://twitter.com/kellydobos/status/1446462895609483273,Positive Sentiment,FALSE,5286,504c1bb3
Skin_Care_Tips_,it be time to clean out your makeup stash,2021-12-22 22:37:14+00:00,Argentina,0,0,0,https://twitter.com/Skin_Care_Tips_/status/1473784723411546118,Negative Sentiment,FALSE,564,0b2c491a
GraziaIndia,from to this year s 2022 show witness the quickest and the most ebullient trend ever,2021-10-12 08:15:03+00:00,Argentina,0,0,0,https://twitter.com/GraziaIndia/status/1447838209841455113,Positive Sentiment,TRUE,1562399,73ad23aa
Codes4Deals,30 count pacifica beauty balance hemp makeup remove wive hemp amp lavender on sale start at 2 49,2021-12-27 23:05:37+00:00,Argentina,0,0,0,https://twitter.com/Codes4Deals/status/1475603807950225418,Neutral Sentiment,FALSE,6573,43f80771
sanctus_online,widen cream or dark spot cream work by control the melanie synthesis in the this in turn prevent black and prevent skin from look dull the be effective to be use in weather,2021-11-17 13:09:48+00:00,Argentina,0,0,0,https://twitter.com/sanctus_online/status/1460958347687907333,Positive Sentiment,FALSE,45,4c354721
abtprettythings,a tilt myspace selfie for the day face_with_tears_of_joy another look use the full bloom eyeshadow palette on my lips i be use the jelly melt lip color in maybe,2021-12-14 21:22:50+00:00,Argentina,0,1,0,https://twitter.com/abtprettythings/status/1470866898191540224,Positive Sentiment,FALSE,118,ea2872b8
frugalli,so good i have to share check out all the items i be love on from,2021-12-24 00:29:58+00:00,Argentina,0,0,0,https://twitter.com/frugalli/status/1474175482631315456,Positive Sentiment,FALSE,97,c83397c0
iamthegrinddoll,they be on sale for only 2 22 nonsticky prohibit vegan seed cruelty free rabbit_face long last hourglass_not_done lightweight feather children friendly girl_medium light_skin_tone girl_medium_skin_tone girl_dark_skin_tone girl_light_skin_tone,2021-12-25 04:49:05+00:00,Argentina,0,0,0,https://twitter.com/iamthegrinddoll/status/1474603076992610305,Neutral Sentiment,FALSE,1024,3037f50b
RosaliqueSkin,happy friday smiling_face_with_smiling_eyes get ready for the weekend with rosalique rosalique s 3 in 1 anti redress miracle formula conceal instantly treat gently and protect long term what be you wait for,2021-11-12 18:02:12+00:00,Argentina,0,0,0,https://twitter.com/RosaliqueSkin/status/1459219995590905859,Positive Sentiment,FALSE,428,19c6e86e
thelookbyjoi,call all star strike get perfect brown in 60 second with the get 10 off today when you sign up to be a brow beste click here gt gt,2021-11-06 08:45:00+00:00,Argentina,0,0,0,https://twitter.com/thelookbyjoi/status/1456905442882379779,Positive Sentiment,FALSE,712,e94e6791
NehaDhupia,from be the girl that use to work n wait towards buy her favourite products off the shelf to now be the face of this brand i thank you for take care of my skin and i thank you for make me a part of your family thank you,2021-11-23 03:59:44+00:00,Argentina,3,2,93,https://twitter.com/NehaDhupia/status/1462994249729785859,Positive Sentiment,TRUE,2800657,d6c69709
RealGirlsWobble,ad julie beauty second skin highlighter review highlighter be a make up that attract light amp can create the illusion of brightness moreover it be a secret weapon for a youthful healthy glow,2021-12-27 08:00:49+00:00,Argentina,0,0,0,https://twitter.com/RealGirlsWobble/status/1475376105439875076,Positive Sentiment,FALSE,550,fdce376c
MFamilymavie,do not go into my life if you do not intend to stay there broken_heart,2021-12-27 21:08:20+00:00,Argentina,0,0,1,https://twitter.com/MFamilymavie/status/1475574289940324352,Negative Sentiment,FALSE,2,069dcad2
postyrandomblog,review face care dari facial wash acne essence tower serum cream day amp night,2021-12-14 10:42:04+00:00,Argentina,0,0,0,https://twitter.com/postyrandomblog/status/1470705641597456384,Neutral Sentiment,FALSE,435,3cd0f87a
tripilates,after all the holiday treat detoxify your skin draw impurities and environmental aggressors from skin while provide intense moisture for softer more supply feel skin,2021-12-27 19:31:07+00:00,Argentina,0,0,0,https://twitter.com/tripilates/status/1475549826209103874,Positive Sentiment,FALSE,1907,2a2abf7b
olreadydotin,bold bridal makeup look smiling_face_with_heart eye spark ma,2021-11-20 15:41:43+00:00,Argentina,0,1,4,https://twitter.com/olreadydotin/status/1462083744806756360,Neutral Sentiment,FALSE,1062,89e62214
NariKesari,best face wash amp cleaners for hyperpigmentation,2021-10-06 09:00:01+00:00,Argentina,0,0,0,https://twitter.com/NariKesari/status/1445675199416860676,Positive Sentiment,FALSE,619,acb990bd
atlsexyslim,my version of a realistic besides the typical this be your sleep paralysis demons or furry comment thank to the rest for appreciation the art face_blowing_a_kiss,2021-12-27 18:37:35+00:00,Argentina,2,8,84,https://twitter.com/atlsexyslim/status/1475536354855505927,Negative Sentiment,TRUE,43211,ceaf4f1b
shop_ippuni,wrapped_gift get a cute bunny headland with every purchase of 50g psalm rabbit_face wrapped_gift free christmas card amp ipni kf94 mask when you purchase rm100 amp above,2021-12-03 06:45:01+00:00,Argentina,0,0,0,https://twitter.com/shop_ippuni/status/1466659722182815746,Neutral Sentiment,FALSE,3679,07886cdf
gokulherbal,be you battle with dash use skin mala keep the dash away,2021-12-10 08:12:06+00:00,Argentina,0,0,1,https://twitter.com/gokulherbal/status/1469218353701003264,Positive Sentiment,FALSE,1,504af329
gemshoppinglive,up next our marvin be present a stun selection of new and period fine estate that be be select for its and uniqueness tune in from 2pm 7pm at,2021-11-10 18:48:33+00:00,Mexico,1,2,4,https://twitter.com/gemshoppinglive/status/1458506884248477707,Positive Sentiment,FALSE,890,fd5338b4
idivia_beauty,anti age products can be use as early as 21 so as soon as you start it be better just make sure to include anti age care accord to your skin type like and follow for more facts or myths smiling_face_with_hearts,2021-12-20 17:09:07+00:00,Argentina,0,0,1,https://twitter.com/idivia_beauty/status/1472977376548118537,Positive Sentiment,FALSE,13,f57164ed
IkransCosmetics,blemish and dull skin be a thing of the past with the ordinary niacinamide amp zinc fixed_bikes call 0729752424,2021-12-27 11:28:37+00:00,Argentina,0,1,3,https://twitter.com/IkransCosmetics/status/1475428401238396932,Positive Sentiment,FALSE,569,f51f75c0
touchofglamglo2,it be the freshness for me learn to take care of your skin it make our work easier,2021-10-16 08:30:11+00:00,Argentina,0,0,1,https://twitter.com/touchofglamglo2/status/1449291568611999748,Positive Sentiment,FALSE,2046,d202ec11
beautydealsbff,flash sale tyson hair tool up to 110 off,2021-12-17 21:18:33+00:00,Argentina,0,0,0,https://twitter.com/beautydealsbff/status/1471952982946160640,Neutral Sentiment,FALSE,712,7774f7d4
NaomieThomas,happiness be the consequence of personal effort,2021-11-21 20:45:19+00:00,Mexico,0,1,9,https://twitter.com/NaomieThomas/status/1462522534847471618,Positive Sentiment,FALSE,295,b9c8911b
SokorpeOfficial,star heal maintain amp protect your skin with cs star award win vitamin c serum and vitamin c intense facial moisturizer influx trade_mark order now and,2021-12-20 16:45:29+00:00,Argentina,1,4,5,https://twitter.com/SokorpeOfficial/status/1472971426038755329,Positive Sentiment,FALSE,45,f3989ff3
PureHealthR,mirror woman get older be a privilege but no one want to look like they be get older right cherry_blossom IF ISTAT DER YE SER cherry_blossom SIN YOU IL,2021-12-27 15:00:02+00:00,Argentina,0,0,1,https://twitter.com/PureHealthR/status/1475481607465283587,Positive Sentiment,FALSE,120,cb316ada
CosmoHaul,randall jenner wear red carpet ready black ball gown to family s low key christmas celebrations,2021-12-27 21:56:49+00:00,Argentina,0,0,0,https://twitter.com/CosmoHaul/status/1475586490952343554,Neutral Sentiment,FALSE,327,a362413f
NuezAcres,men s_room men and serum do you use them what make you decide it be time to start,2021-10-01 14:15:11+00:00,Argentina,0,0,1,https://twitter.com/NuezAcres/status/1443942574125891612,Neutral Sentiment,FALSE,260,49483ca1
mrsm76,do not let block pore and dead skin cells ruin all of your skin aspirations see no evil_monkey i know this can be dishearten but there be something you can do get yourself a good quality exfoliator that suit your skin type,2021-12-27 16:52:11+00:00,Argentina,0,0,0,https://twitter.com/mrsm76/status/1475509829028528130,Positive Sentiment,FALSE,55,ec014b34
ShiraEsthetics,a luxurious amp lightweight eye serum that effectively reduce the appearance of illness around area while gently flourish the delicate under the,2021-10-13 01:11:10+00:00,Argentina,0,1,0,https://twitter.com/ShiraEsthetics/status/1448093924455849986,Positive Sentiment,FALSE,380,ec6ebe35
Zobhalifeindia,make your christmas terrier with amaze sincere products by cobra,2021-12-25 02:57:28+00:00,Argentina,0,0,1,https://twitter.com/Zobhalifeindia/status/1474574989726683136,Positive Sentiment,FALSE,73,fe4095e5
VanguardDermNY,new year new skin treat yourself this new year with one of our many cosmetic service that leave you feel relax amp rejuvenate appointments be available so give us a call today at 212 398 1288 to book yours,2021-12-27 19:00:40+00:00,Argentina,0,0,0,https://twitter.com/VanguardDermNY/status/1475542163861688323,Positive Sentiment,FALSE,262,33b171cc
BirlaHealthcare,essentials for hair zinc zinc reduce hair loss and increase its density vitamin a vitamin a prevent hair wreckage late late stimulate growth violin violin boost certain vitamin d it activate hair follicle,2021-12-17 06:39:56+00:00,Argentina,0,0,0,https://twitter.com/BirlaHealthcare/status/1471731873634471937,Positive Sentiment,FALSE,6,1ef26180
digireena,a fun and sweet way to add some spare to your day spark lipstick camera_with_flash,2021-12-27 09:18:37+00:00,Argentina,0,0,0,https://twitter.com/digireena/status/1475395684912320514,Positive Sentiment,FALSE,140,216bfae7
livecrude,thank for go back to school with us this month as we und ck our and learn what it mean to be clean green_heart,2021-09-30 22:22:57+00:00,Argentina,1,0,0,https://twitter.com/livecrude/status/1443702938354999297,Negative Sentiment,FALSE,440,431f59b1
FBC_Inc,our hulk face mask have you try it great for mature skin link be in bio,2021-10-14 21:48:51+00:00,Mexico,0,0,0,https://twitter.com/FBC_Inc/status/1448767787401363456,Neutral Sentiment,FALSE,196,5dfa8e57
Centric_PLM,with in place and company be able to share information and track change and approvals from a single digital interface learn how,2021-12-27 17:00:10+00:00,Argentina,0,0,0,https://twitter.com/Centric_PLM/status/1475511837902970886,Neutral Sentiment,FALSE,1189,b231380f
WorsleyLaser,new product come soon this be most definitely on my hot list for january worse laser clinic,2021-12-22 17:47:26+00:00,Argentina,0,0,0,https://twitter.com/WorsleyLaser/status/1473711795596673025,Neutral Sentiment,FALSE,1524,8df7cd10
grace_teachers,teachers grace extra hydration amp moisturise serum be an oil free non grease aqueous serum that blend with every skin type and color and enhance the natural skin tone click here to order,2021-12-23 07:53:43+00:00,Argentina,0,0,2,https://twitter.com/grace_teachers/status/1473924769565544448,Positive Sentiment,FALSE,19,f7934829
SkinFunctional,should you exfoliate active acne exfoliate when you have acne be very important as acne cause bacteria thrive on dead skin cells red_circle,2021-12-21 14:02:02+00:00,Argentina,0,0,0,https://twitter.com/SkinFunctional/status/1473292680331513856,Positive Sentiment,FALSE,1287,2f1917d5
TRESemmeUKI,when it be almost christmas but we have start tamper ourselves long before woman_getting_massage our violin repair instant recovery mask visibly repair 7 type of damage in just one use so you just sit back relax and enjoy the compliment after woman_tipping_hand,2021-12-23 17:00:03+00:00,Argentina,0,0,1,https://twitter.com/TRESemmeUKI/status/1474062257168523266,Neutral Sentiment,TRUE,45752,541553f6
cjthist,here be the most amaze top tip for discover your ideal nude lip and how to utterly rock the look no matter the occasion,2021-12-27 18:20:12+00:00,Argentina,0,0,0,https://twitter.com/cjthist/status/1475531978107760646,Positive Sentiment,FALSE,34,56a8870c
plastixdocs,have you ever wonder what the benefit of som salt be make sure you check out our guide,2021-12-27 21:01:06+00:00,Argentina,0,0,0,https://twitter.com/plastixdocs/status/1475572472133169156,Neutral Sentiment,FALSE,1195,8b3b27bc
pro_beauty,transparent product claim and prevention over cure be just some of the trend shape consumers beauty purchase right now,2021-11-06 20:33:00+00:00,Argentina,0,0,0,https://twitter.com/pro_beauty/status/1457083616937197568,Negative Sentiment,FALSE,38356,720a7f4d
kiss_mineral,beach_with_umbrella brush on block by kiss mineral be a revolutionary onscreen sun_with_face in powder form formulate with natural minerals amp botanical ingredients keep your skin safe in the harsh sun all day backhand_index_pointing_left shopping_cart,2021-12-27 14:52:56+00:00,Argentina,0,0,2,https://twitter.com/kiss_mineral/status/1475479820536455168,Positive Sentiment,FALSE,209,fe407f0e
Kendraspondence,the cite wonderland nascar be needle in my opinion but no longer carry at maybe my raven have a duplicate to recommend,2021-12-24 16:36:18+00:00,Argentina,0,0,0,https://twitter.com/Kendraspondence/status/1474418669883170816,Negative Sentiment,FALSE,2289,6cdd4497
Teladoc,winter time can be brutal on the skin check out these tip about how to prevent the damage that the cold cause,2021-12-03 18:50:02+00:00,Argentina,2,0,1,https://twitter.com/Teladoc/status/1466842177858945029,Negative Sentiment,TRUE,3370,a2fd7c39
orlock13,so good i have to share check out all the items i be love on from,2021-12-20 02:31:23+00:00,Argentina,0,0,0,https://twitter.com/orlock13/status/1472756486933663745,Positive Sentiment,FALSE,60,3a1a5838
lux_simple,get your skin the love it deserve this complete sincere bundle be amaze and i use it every day especially the post workout spray Use my 40 off code OE HOP,2021-10-10 00:05:32+00:00,Argentina,0,0,0,https://twitter.com/lux_simple/status/1446990243849293826,Positive Sentiment,FALSE,55,dc89424a
rgs14,fan amp long time user actor sign on as ambassador for the brand in nea will promote the brand s philosophy of skin health amp its award win g products amp treatments,2021-11-22 13:21:50+00:00,Argentina,0,0,1,https://twitter.com/rgs14/status/1462773316209446912,Neutral Sentiment,FALSE,96,cb723a12
MissNillaPriss,allergies have be a bitch and only be able to play occasionally be depress but i be happy with this,2021-12-01 04:38:16+00:00,Argentina,1,3,5,https://twitter.com/MissNillaPriss/status/1465903047339614209,Negative Sentiment,FALSE,1141,6b1f57ef
gingersnaps82,love this hair into idea smiling_face_with_heart eye classy,2021-12-19 09:25:55+00:00,Argentina,0,0,0,https://twitter.com/gingersnaps82/status/1472498419927339010,Positive Sentiment,FALSE,406,bfdb7f98
melissa_hobson,these be officially my newest bathroom obsession this collection leave my skin look clean and smell wonderful smiling_face_with_hearts,2021-12-27 16:20:32+00:00,Argentina,0,0,0,https://twitter.com/melissa_hobson/status/1475501864737296384,Positive Sentiment,FALSE,166,17edd7fd
Sexy1008Sexy,with just over 90 anti flashback powder the one s make up pro loose powder make my skin look its absolute best in photos and videos with its amaze 12 hour matte finish smiling_face_with_heart eye message me for the incredible price beating_face_with_smiling_eyes,2021-12-27 12:10:30+00:00,Argentina,0,0,0,https://twitter.com/Sexy1008Sexy/status/1475438938865164289,Positive Sentiment,FALSE,41,8d9f1736
foreveruzuri,she want some tlc and that be exactly what we give her with our zur signature enzyme facial spark service be still 30 off until the end of the year black_heart,2021-12-21 02:50:25+00:00,Argentina,0,0,0,https://twitter.com/foreveruzuri/status/1473123665441177606,Neutral Sentiment,FALSE,210,089a414d
glowupcoach21,beauty be always skin deep,2021-12-24 15:46:58+00:00,Argentina,0,0,0,https://twitter.com/glowupcoach21/status/1474406251132067858,Positive Sentiment,FALSE,1309,594555dd
ValerieValoir,i use mine almost every day even during the winter months smiling_face_with_sunglasses buy yours here,2021-12-20 22:12:42+00:00,Argentina,0,0,0,https://twitter.com/ValerieValoir/status/1473053773761290253,Neutral Sentiment,FALSE,11,fe0e0ffd
PortiaM_Skin,skin routine smiling_face_with_hearts woman_dancing camera_with_flash from instagram,2021-10-09 11:29:18+00:00,Argentina,0,1,7,https://twitter.com/PortiaM_Skin/status/1446799930450919427,Neutral Sentiment,FALSE,38458,96a5aa3f
Dunnimi_,we all want clear bright hydrate skin but the quest for healthy skin can be intimidate with so many products in the market it can be confuse to know when and how often you should be use them,2021-12-23 05:54:32+00:00,Argentina,1,11,9,https://twitter.com/Dunnimi_/status/1473894776021733377,Negative Sentiment,FALSE,431,84025f50
fashionsfinest,we do not need any crystal ball to predict next year s tia road founder and ceo of share with us her prediction for 2022 what will be hot and what not find out here,2021-12-15 16:02:21+00:00,Argentina,0,3,5,https://twitter.com/fashionsfinest/status/1471148631705145353,Neutral Sentiment,FALSE,5555,d73bafe1
Lujobox1,wonder what to gift your male friends amp relatives this festive season we have get your back present the ultimate hair body and skin care lujobox for him,2021-11-13 06:20:03+00:00,Argentina,0,0,0,https://twitter.com/Lujobox1/status/1459405682394861572,Neutral Sentiment,FALSE,78,0d3acecc
dustofsoul,amaze make up artist for the wonderland project,2021-10-03 12:19:34+00:00,France,0,0,6,https://twitter.com/dustofsoul/status/1444638253143965699,Positive Sentiment,FALSE,341,09799f0f
